{
  "$schema": "https://json-schema.org/draft/2020-12/schema",
  "$id": "https://raw.githubusercontent.com/yanjinzheng2005-gif/cli-channel-parity/main/schema/channel-parity.schema.json",
  "title": "CLI Release Channel Parity configuration",
  "type": "object",
  "required": ["schemaVersion", "product", "channels"],
  "properties": {
    "schemaVersion": { "const": 1 },
    "product": { "type": "string", "minLength": 1 },
    "expectedVersion": { "type": "string", "minLength": 1 },
    "redactions": { "type": "array", "items": { "type": "string", "minLength": 4 } },
    "defaults": {
      "type": "object",
      "properties": {
        "timeoutMs": { "type": "integer", "minimum": 1 },
        "maxOutputBytes": { "type": "integer", "minimum": 1 }
      },
      "additionalProperties": false
    },
    "channels": {
      "type": "array",
      "minItems": 1,
      "items": { "$ref": "#/$defs/channel" }
    }
  },
  "additionalProperties": true,
  "$defs": {
    "command": {
      "type": "object",
      "required": ["argv"],
      "properties": {
        "argv": { "type": "array", "minItems": 1, "items": { "type": "string", "minLength": 1 } },
        "cwd": { "type": "string", "minLength": 1 },
        "env": { "type": "object", "additionalProperties": { "type": "string" } },
        "timeoutMs": { "type": "integer", "minimum": 1 },
        "maxOutputBytes": { "type": "integer", "minimum": 1 },
        "allowedExitCodes": { "type": "array", "items": { "type": "integer" } }
      },
      "additionalProperties": false
    },
    "channel": {
      "type": "object",
      "required": ["id", "executable", "install"],
      "properties": {
        "id": { "type": "string", "minLength": 1 },
        "label": { "type": "string", "minLength": 1 },
        "executable": { "type": "string", "minLength": 1 },
        "expectedVersion": { "type": "string", "minLength": 1 },
        "expectedExecutablePath": { "type": "string", "minLength": 1 },
        "pathPolicy": { "enum": ["report", "single", "first-must-match"] },
        "install": { "$ref": "#/$defs/command" },
        "version": { "$ref": "#/$defs/command" },
        "launch": { "$ref": "#/$defs/command" },
        "uninstall": { "$ref": "#/$defs/command" },
        "env": { "type": "object", "additionalProperties": { "type": "string" } },
        "transientPatterns": { "type": "array", "items": { "type": "string" } },
        "residuePaths": { "type": "array", "items": { "type": "string" } },
        "helpers": {
          "type": "array",
          "items": {
            "type": "object",
            "required": ["name", "path"],
            "properties": {
              "name": { "type": "string", "minLength": 1 },
              "path": { "type": "string", "minLength": 1 },
              "required": { "type": "boolean" }
            },
            "additionalProperties": false
          }
        }
      },
      "additionalProperties": false
    }
  }
}
